{
  "domain": "ai-film-rights",
  "version": 1,
  "cohort": {
    "id": "co-2026s",
    "name": "2026春季AI影视创作营",
    "started_on": "2026-03-02",
    "student_quota": 84,
    "team_quota": 33
  },
  "students": [
    {
      "id": "st-001",
      "code": "学员编号001",
      "major": "导演",
      "team_id": "tm-01",
      "status": "在队",
      "exited_on": null,
      "exit_note": null
    },
    {
      "id": "st-002",
      "code": "学员编号002",
      "major": "编剧",
      "team_id": "tm-01",
      "status": "在队",
      "exited_on": null,
      "exit_note": null
    },
    {
      "id": "st-003",
      "code": "学员编号003",
      "major": "摄影",
      "team_id": "tm-01",
      "status": "在队",
      "exited_on": null,
      "exit_note": null
    },
    {
      "id": "st-004",
      "code": "学员编号004",
      "major": "美术",
      "team_id": "tm-02",
      "status": "在队",
      "exited_on": null,
      "exit_note": null
    },
    {
      "id": "st-005",
      "code": "学员编号005",
      "major": "表演",
      "team_id": "tm-02",
      "status": "在队",
      "exited_on": null,
      "exit_note": null
    },
    {
      "id": "st-006",
      "code": "学员编号006",
      "major": "动画",
      "team_id": "tm-02",
      "status": "在队",
      "exited_on": null,
      "exit_note": null
    },
    {
      "id": "st-007",
      "code": "学员编号007",
      "major": "声音设计",
      "team_id": "tm-03",
      "status": "在队",
      "exited_on": null,
      "exit_note": null
    },
    {
      "id": "st-008",
      "code": "学员编号008",
      "major": "音乐",
      "team_id": "tm-03",
      "status": "在队",
      "exited_on": null,
      "exit_note": null
    },
    {
      "id": "st-009",
      "code": "学员编号009",
      "major": "数字媒体",
      "team_id": "tm-03",
      "status": "在队",
      "exited_on": null,
      "exit_note": null
    },
    {
      "id": "st-010",
      "code": "学员编号010",
      "major": "人工智能",
      "team_id": "tm-04",
      "status": "在队",
      "exited_on": null,
      "exit_note": null
    },
    {
      "id": "st-011",
      "code": "学员编号011",
      "major": "法学",
      "team_id": "tm-04",
      "status": "在队",
      "exited_on": null,
      "exit_note": null
    },
    {
      "id": "st-012",
      "code": "学员编号012",
      "major": "市场营销",
      "team_id": "tm-04",
      "status": "在队",
      "exited_on": null,
      "exit_note": null
    },
    {
      "id": "st-013",
      "code": "学员编号013",
      "major": "导演",
      "team_id": "tm-05",
      "status": "在队",
      "exited_on": null,
      "exit_note": null
    },
    {
      "id": "st-014",
      "code": "学员编号014",
      "major": "编剧",
      "team_id": "tm-05",
      "status": "在队",
      "exited_on": null,
      "exit_note": null
    },
    {
      "id": "st-015",
      "code": "学员编号015",
      "major": "摄影",
      "team_id": "tm-05",
      "status": "在队",
      "exited_on": null,
      "exit_note": null
    },
    {
      "id": "st-016",
      "code": "学员编号016",
      "major": "美术",
      "team_id": "tm-06",
      "status": "在队",
      "exited_on": null,
      "exit_note": null
    },
    {
      "id": "st-017",
      "code": "学员编号017",
      "major": "表演",
      "team_id": "tm-06",
      "status": "在队",
      "exited_on": null,
      "exit_note": null
    },
    {
      "id": "st-018",
      "code": "学员编号018",
      "major": "动画",
      "team_id": "tm-06",
      "status": "在队",
      "exited_on": null,
      "exit_note": null
    },
    {
      "id": "st-019",
      "code": "学员编号019",
      "major": "声音设计",
      "team_id": "tm-07",
      "status": "在队",
      "exited_on": null,
      "exit_note": null
    },
    {
      "id": "st-020",
      "code": "学员编号020",
      "major": "音乐",
      "team_id": "tm-07",
      "status": "已退出",
      "exited_on": "2026-05-30",
      "exit_note": "个人原因退出，已签署贡献与配音许可保留确认"
    },
    {
      "id": "st-021",
      "code": "学员编号021",
      "major": "数字媒体",
      "team_id": "tm-07",
      "status": "在队",
      "exited_on": null,
      "exit_note": null
    },
    {
      "id": "st-022",
      "code": "学员编号022",
      "major": "人工智能",
      "team_id": "tm-08",
      "status": "在队",
      "exited_on": null,
      "exit_note": null
    },
    {
      "id": "st-023",
      "code": "学员编号023",
      "major": "法学",
      "team_id": "tm-08",
      "status": "在队",
      "exited_on": null,
      "exit_note": null
    },
    {
      "id": "st-024",
      "code": "学员编号024",
      "major": "市场营销",
      "team_id": "tm-08",
      "status": "在队",
      "exited_on": null,
      "exit_note": null
    },
    {
      "id": "st-025",
      "code": "学员编号025",
      "major": "导演",
      "team_id": "tm-09",
      "status": "在队",
      "exited_on": null,
      "exit_note": null
    },
    {
      "id": "st-026",
      "code": "学员编号026",
      "major": "编剧",
      "team_id": "tm-09",
      "status": "在队",
      "exited_on": null,
      "exit_note": null
    },
    {
      "id": "st-027",
      "code": "学员编号027",
      "major": "摄影",
      "team_id": "tm-09",
      "status": "在队",
      "exited_on": null,
      "exit_note": null
    },
    {
      "id": "st-028",
      "code": "学员编号028",
      "major": "美术",
      "team_id": "tm-10",
      "status": "在队",
      "exited_on": null,
      "exit_note": null
    },
    {
      "id": "st-029",
      "code": "学员编号029",
      "major": "表演",
      "team_id": "tm-10",
      "status": "在队",
      "exited_on": null,
      "exit_note": null
    },
    {
      "id": "st-030",
      "code": "学员编号030",
      "major": "动画",
      "team_id": "tm-10",
      "status": "在队",
      "exited_on": null,
      "exit_note": null
    },
    {
      "id": "st-031",
      "code": "学员编号031",
      "major": "声音设计",
      "team_id": "tm-11",
      "status": "在队",
      "exited_on": null,
      "exit_note": null
    },
    {
      "id": "st-032",
      "code": "学员编号032",
      "major": "音乐",
      "team_id": "tm-11",
      "status": "在队",
      "exited_on": null,
      "exit_note": null
    },
    {
      "id": "st-033",
      "code": "学员编号033",
      "major": "数字媒体",
      "team_id": "tm-11",
      "status": "在队",
      "exited_on": null,
      "exit_note": null
    },
    {
      "id": "st-034",
      "code": "学员编号034",
      "major": "人工智能",
      "team_id": "tm-12",
      "status": "在队",
      "exited_on": null,
      "exit_note": null
    },
    {
      "id": "st-035",
      "code": "学员编号035",
      "major": "法学",
      "team_id": "tm-12",
      "status": "在队",
      "exited_on": null,
      "exit_note": null
    },
    {
      "id": "st-036",
      "code": "学员编号036",
      "major": "市场营销",
      "team_id": "tm-12",
      "status": "在队",
      "exited_on": null,
      "exit_note": null
    },
    {
      "id": "st-037",
      "code": "学员编号037",
      "major": "导演",
      "team_id": "tm-13",
      "status": "在队",
      "exited_on": null,
      "exit_note": null
    },
    {
      "id": "st-038",
      "code": "学员编号038",
      "major": "编剧",
      "team_id": "tm-13",
      "status": "在队",
      "exited_on": null,
      "exit_note": null
    },
    {
      "id": "st-039",
      "code": "学员编号039",
      "major": "摄影",
      "team_id": "tm-13",
      "status": "在队",
      "exited_on": null,
      "exit_note": null
    },
    {
      "id": "st-040",
      "code": "学员编号040",
      "major": "美术",
      "team_id": "tm-14",
      "status": "在队",
      "exited_on": null,
      "exit_note": null
    },
    {
      "id": "st-041",
      "code": "学员编号041",
      "major": "表演",
      "team_id": "tm-14",
      "status": "在队",
      "exited_on": null,
      "exit_note": null
    },
    {
      "id": "st-042",
      "code": "学员编号042",
      "major": "动画",
      "team_id": "tm-14",
      "status": "在队",
      "exited_on": null,
      "exit_note": null
    },
    {
      "id": "st-043",
      "code": "学员编号043",
      "major": "声音设计",
      "team_id": "tm-15",
      "status": "在队",
      "exited_on": null,
      "exit_note": null
    },
    {
      "id": "st-044",
      "code": "学员编号044",
      "major": "音乐",
      "team_id": "tm-15",
      "status": "在队",
      "exited_on": null,
      "exit_note": null
    },
    {
      "id": "st-045",
      "code": "学员编号045",
      "major": "数字媒体",
      "team_id": "tm-15",
      "status": "在队",
      "exited_on": null,
      "exit_note": null
    },
    {
      "id": "st-046",
      "code": "学员编号046",
      "major": "人工智能",
      "team_id": "tm-16",
      "status": "在队",
      "exited_on": null,
      "exit_note": null
    },
    {
      "id": "st-047",
      "code": "学员编号047",
      "major": "法学",
      "team_id": "tm-16",
      "status": "在队",
      "exited_on": null,
      "exit_note": null
    },
    {
      "id": "st-048",
      "code": "学员编号048",
      "major": "市场营销",
      "team_id": "tm-16",
      "status": "在队",
      "exited_on": null,
      "exit_note": null
    },
    {
      "id": "st-049",
      "code": "学员编号049",
      "major": "导演",
      "team_id": "tm-17",
      "status": "在队",
      "exited_on": null,
      "exit_note": null
    },
    {
      "id": "st-050",
      "code": "学员编号050",
      "major": "编剧",
      "team_id": "tm-17",
      "status": "在队",
      "exited_on": null,
      "exit_note": null
    },
    {
      "id": "st-051",
      "code": "学员编号051",
      "major": "摄影",
      "team_id": "tm-17",
      "status": "在队",
      "exited_on": null,
      "exit_note": null
    },
    {
      "id": "st-052",
      "code": "学员编号052",
      "major": "美术",
      "team_id": "tm-18",
      "status": "在队",
      "exited_on": null,
      "exit_note": null
    },
    {
      "id": "st-053",
      "code": "学员编号053",
      "major": "表演",
      "team_id": "tm-18",
      "status": "在队",
      "exited_on": null,
      "exit_note": null
    },
    {
      "id": "st-054",
      "code": "学员编号054",
      "major": "动画",
      "team_id": "tm-18",
      "status": "在队",
      "exited_on": null,
      "exit_note": null
    },
    {
      "id": "st-055",
      "code": "学员编号055",
      "major": "声音设计",
      "team_id": "tm-19",